{
  "version": "1.0.1",
  "description": "WebRTC microphone test with opksrc internal black video and silence fallback.",
  "sourceInfo": "opksrc black video and browser microphone",
  "loop": false,
  "pipeline": [
    "opksrc name=source ws-port=8003",
    "source.video ! queue !",
    "opksink name=sink",
    "source.src !",
    "queue ! sink.audiosink"
  ]
}
